{
  "id": "marsh",
  "category": "illustration",
  "prompt": "Illustrate a quiet moonlit salt marsh from primitives. A small amber-lit cabin is the focal point, with three pale birds, dark reed beds and a broken reflection leading the eye toward the cabin. Use indigo, muted teal and warm cream. A small caption may sit beneath the scene. Preserve a feeling of stillness.",
  "max_edits": 5
}
