{
  "id": "reading-club",
  "category": "poster",
  "prompt": "Create a square editorial invitation for AFTER HOURS, a reading club evening featuring The Quiet Atlas. Use the supplied book cover intact. Include OCT 17 / 7PM, EAST ROOM and READ SOMETHING DIFFERENT. Midnight blue and warm amber should feel intimate and literary. Keep the hierarchy clear and all copy readable.",
  "max_edits": 5
}
